{
  "$schema": "https://json-schema.org/draft/2020-12/schema",
  "title": "Tech Reader module",
  "type": "object",
  "required": ["key", "route", "scopeId", "title", "subtitle", "styles", "content", "toc"],
  "properties": {
    "key": { "type": "string", "minLength": 1 },
    "route": { "type": "string", "pattern": "^#/" },
    "scopeId": { "type": "string", "minLength": 1 },
    "title": { "type": "string", "minLength": 1 },
    "subtitle": { "type": "string" },
    "styles": { "type": "array", "items": { "type": "string" } },
    "content": {
      "type": "array",
      "minItems": 1,
      "items": {
        "type": "object",
        "required": ["id", "file"],
        "properties": {
          "id": { "type": "string", "minLength": 1 },
          "sectionId": { "type": "string" },
          "file": { "type": "string", "minLength": 1 }
        },
        "additionalProperties": false
      }
    },
    "toc": { "type": "array" }
  },
  "additionalProperties": false
}
